{
  "$schema": "https://json-schema.org/draft/2020-12/schema",
  "title": "Games as Art Index collection",
  "type": "object",
  "required": ["id", "title", "description", "color", "resources"],
  "properties": {
    "id": { "type": "string", "pattern": "^[a-z0-9]+(?:-[a-z0-9]+)*$" },
    "title": { "type": "string", "minLength": 1 },
    "description": { "type": "string", "minLength": 1 },
    "color": { "type": "string", "enum": ["red", "gold", "blue", "green", "violet"] },
    "resources": {
      "type": "array",
      "minItems": 3,
      "uniqueItems": true,
      "items": { "type": "string", "pattern": "^[a-z0-9]+(?:-[a-z0-9]+)*$" }
    }
  },
  "additionalProperties": false
}
