{
  "id": "start-game-design",
  "title": "Game design fundamentals",
  "description": "Build a working vocabulary for mechanics and player experience, then move through prototyping, playtesting, feedback, and reflective design practice.",
  "color": "red",
  "resources": [
    "elements-game-design",
    "game-design-workshop",
    "mda-framework",
    "juice-it-or-lose-it",
    "designing-games"
  ]
}
