{
  "id": "technical-foundations",
  "title": "Gameplay programming and simulation",
  "description": "Move from reusable game-code architecture into pathfinding, fixed-step simulation, networking, historical state, and primary-source engine code.",
  "color": "blue",
  "resources": [
    "game-programming-patterns",
    "red-blob-pathfinding",
    "gaffer-on-games",
    "braid-rewind-implementation",
    "id-source-code"
  ]
}
