{
  "id": "history-from-sources",
  "title": "Studying game history from evidence",
  "description": "Build historical arguments from first-hand postmortems, source code, archives, hardware constraints, and carefully researched platform studies.",
  "color": "green",
  "resources": [
    "doom-postmortem",
    "prince-of-persia-postmortem",
    "id-source-code",
    "vghf-library",
    "racing-the-beam",
    "i-am-error"
  ]
}
