{
  "id": "level-and-space",
  "title": "Level design: teaching, pacing, and place",
  "description": "Move from architectural principles to concrete studies of movement, puzzle spaces, emotional pacing, environmental art, and the tools used to build playable places.",
  "color": "gold",
  "resources": [
    "architectural-level-design",
    "designing-celeste",
    "witness-architecture",
    "designing-journey",
    "art-of-firewatch",
    "valve-level-design"
  ]
}
