{
  "id": "narrative-design",
  "title": "Narrative design beyond branching",
  "description": "Start with what digital media can do differently, then move through collaborative game writing, interactive-fiction practice, character systems, and procedural approaches to story.",
  "color": "violet",
  "resources": [
    "hamlet-holodeck",
    "game-writing",
    "emily-short-blog",
    "narrative-legos",
    "procedural-storytelling"
  ]
}
