{
  "id": "first-project",
  "title": "Build and finish your first game",
  "description": "Start with either the Godot or Unity starter course, then use the scope, production, accessibility, and release guidance to finish a small playable project.",
  "color": "violet",
  "resources": [
    "finishing-a-game",
    "godot-first-2d",
    "unity-create-code",
    "gaming-accessibility-fundamentals",
    "playful-production"
  ]
}
