{
  "id": "sound-and-music",
  "title": "Game audio: intention to implementation",
  "description": "Learn the structure of interactive audio, implement it in game tools, plan adaptive music, and compare two detailed production cases before exploring procedural sound.",
  "color": "blue",
  "resources": [
    "game-audio-tutorial",
    "game-audio-implementation",
    "composers-guide-game-music",
    "witness-audio",
    "doom-behind-music",
    "designing-sound"
  ]
}
